{
  "schema_version": 1,
  "id": "dev",
  "kind": "micro-pack",
  "name": "Dev micro pack",
  "description": "Developer icons: bug, branch, terminal, package",
  "tier": "official",
  "license": "MIT",
  "repository": "https://github.com/buchochelliq-labs/rs-rich-cli",
  "versions": [
    {
      "version": "1.0.0",
      "published": "2026-10-26",
      "requires": {
        "micro_schema": 1
      },
      "artifact": {
        "url": "https://raw.githubusercontent.com/buchochelliq-labs/rs-rich-marketplace/main/artifacts/dev/dev-1.0.0.richmicro",
        "sha256": "a5b914f10314a2e469fd68e45ecfc63bbd122c1121e65248f1bcbb93cd407059",
        "size": 4597
      },
      "capabilities": [
        {
          "kind": "asset",
          "name": "dev/branch"
        },
        {
          "kind": "asset",
          "name": "dev/bug"
        },
        {
          "kind": "asset",
          "name": "dev/package"
        },
        {
          "kind": "asset",
          "name": "dev/terminal"
        }
      ],
      "permissions": []
    }
  ],
  "authors": [
    "rs-rich contributors"
  ],
  "homepage": "https://github.com/buchochelliq-labs/rs-rich-cli/tree/main/crates/rich-micro/builtin/dev",
  "keywords": [
    "micro",
    "icons",
    "dev"
  ]
}
