{
  "schema_version": 1,
  "id": "dusk",
  "kind": "theme",
  "name": "Dusk theme",
  "description": "A dark theme in violets and teals, for a dark terminal background",
  "tier": "official",
  "license": "MIT",
  "repository": "https://github.com/buchochelliq-labs/rs-rich-cli",
  "versions": [
    {
      "version": "1.0.0",
      "published": "2026-10-26",
      "requires": {
        "theme_format": 1
      },
      "artifact": {
        "url": "https://github.com/buchochelliq-labs/rs-rich-marketplace/releases/download/dusk-v1.0.0/dusk-1.0.0.ini",
        "sha256": "6c5af968c76ad7be6f5c9437109b60f4bc0dac5e0362b7ac99f35881f33cc8db",
        "size": 4524
      },
      "source_revision": "d26de521746b47baa479b0f7c902f2ed8909b580",
      "capabilities": [
        {
          "kind": "theme",
          "name": "dusk"
        }
      ],
      "permissions": []
    }
  ],
  "homepage": "https://github.com/buchochelliq-labs/rs-rich-cli/blob/main/crates/rich-cli/official/themes/dusk.ini",
  "authors": [
    "rs-rich contributors"
  ],
  "keywords": [
    "theme",
    "dark"
  ]
}
